{
  "ordering": [
    ["A1", "B1", "C1", "D1"],
    ["A2", "B2", "C2", "D2"],
    ["A3", "B3", "C3", "D3"],
    ["A4", "B4", "C4", "D4"],
    ["A5", "B5", "C5", "D5"],
    ["A6", "B6", "C6", "D6"]
  ],
  "schemaVersion": 2,
  "version": 1,
  "namespace": "opentrons",
  "metadata": {
    "displayVolumeUnits": "mL",
    "displayCategory": "tubeRack",
    "displayName": "Opentrons 24 Tube Rack with Generic 2 mL Screwcap",
    "tags": []
  },
  "dimensions": {
    "xDimension": 127.75,
    "yDimension": 85.5,
    "zDimension": 84
  },
  "parameters": {
    "format": "irregular",
    "isTiprack": false,
    "loadName": "opentrons_24_tuberack_generic_2ml_screwcap",
    "isMagneticModuleCompatible": false
  },
  "wells": {
    "D1": {
      "depth": 42,
      "diameter": 8.5,
      "shape": "circular",
      "totalLiquidVolume": 2000,
      "x": 18.21,
      "y": 17.59,
      "z": 42
    },
    "C1": {
      "depth": 42,
      "diameter": 8.5,
      "shape": "circular",
      "totalLiquidVolume": 2000,
      "x": 18.21,
      "y": 36.87,
      "z": 42
    },
    "B1": {
      "depth": 42,
      "diameter": 8.5,
      "shape": "circular",
      "totalLiquidVolume": 2000,
      "x": 18.21,
      "y": 56.15,
      "z": 42
    },
    "A1": {
      "depth": 42,
      "diameter": 8.5,
      "shape": "circular",
      "totalLiquidVolume": 2000,
      "x": 18.21,
      "y": 75.43,
      "z": 42
    },
    "D2": {
      "depth": 42,
      "diameter": 8.5,
      "shape": "circular",
      "totalLiquidVolume": 2000,
      "x": 38.1,
      "y": 17.59,
      "z": 42
    },
    "C2": {
      "depth": 42,
      "diameter": 8.5,
      "shape": "circular",
      "totalLiquidVolume": 2000,
      "x": 38.1,
      "y": 36.87,
      "z": 42
    },
    "B2": {
      "depth": 42,
      "diameter": 8.5,
      "shape": "circular",
      "totalLiquidVolume": 2000,
      "x": 38.1,
      "y": 56.15,
      "z": 42
    },
    "A2": {
      "depth": 42,
      "diameter": 8.5,
      "shape": "circular",
      "totalLiquidVolume": 2000,
      "x": 38.1,
      "y": 75.43,
      "z": 42
    },
    "D3": {
      "depth": 42,
      "diameter": 8.5,
      "shape": "circular",
      "totalLiquidVolume": 2000,
      "x": 57.99,
      "y": 17.59,
      "z": 42
    },
    "C3": {
      "depth": 42,
      "diameter": 8.5,
      "shape": "circular",
      "totalLiquidVolume": 2000,
      "x": 57.99,
      "y": 36.87,
      "z": 42
    },
    "B3": {
      "depth": 42,
      "diameter": 8.5,
      "shape": "circular",
      "totalLiquidVolume": 2000,
      "x": 57.99,
      "y": 56.15,
      "z": 42
    },
    "A3": {
      "depth": 42,
      "diameter": 8.5,
      "shape": "circular",
      "totalLiquidVolume": 2000,
      "x": 57.99,
      "y": 75.43,
      "z": 42
    },
    "D4": {
      "depth": 42,
      "diameter": 8.5,
      "shape": "circular",
      "totalLiquidVolume": 2000,
      "x": 77.88,
      "y": 17.59,
      "z": 42
    },
    "C4": {
      "depth": 42,
      "diameter": 8.5,
      "shape": "circular",
      "totalLiquidVolume": 2000,
      "x": 77.88,
      "y": 36.87,
      "z": 42
    },
    "B4": {
      "depth": 42,
      "diameter": 8.5,
      "shape": "circular",
      "totalLiquidVolume": 2000,
      "x": 77.88,
      "y": 56.15,
      "z": 42
    },
    "A4": {
      "depth": 42,
      "diameter": 8.5,
      "shape": "circular",
      "totalLiquidVolume": 2000,
      "x": 77.88,
      "y": 75.43,
      "z": 42
    },
    "D5": {
      "depth": 42,
      "diameter": 8.5,
      "shape": "circular",
      "totalLiquidVolume": 2000,
      "x": 97.77,
      "y": 17.59,
      "z": 42
    },
    "C5": {
      "depth": 42,
      "diameter": 8.5,
      "shape": "circular",
      "totalLiquidVolume": 2000,
      "x": 97.77,
      "y": 36.87,
      "z": 42
    },
    "B5": {
      "depth": 42,
      "diameter": 8.5,
      "shape": "circular",
      "totalLiquidVolume": 2000,
      "x": 97.77,
      "y": 56.15,
      "z": 42
    },
    "A5": {
      "depth": 42,
      "diameter": 8.5,
      "shape": "circular",
      "totalLiquidVolume": 2000,
      "x": 97.77,
      "y": 75.43,
      "z": 42
    },
    "D6": {
      "depth": 42,
      "diameter": 8.5,
      "shape": "circular",
      "totalLiquidVolume": 2000,
      "x": 117.66,
      "y": 17.59,
      "z": 42
    },
    "C6": {
      "depth": 42,
      "diameter": 8.5,
      "shape": "circular",
      "totalLiquidVolume": 2000,
      "x": 117.66,
      "y": 36.87,
      "z": 42
    },
    "B6": {
      "depth": 42,
      "diameter": 8.5,
      "shape": "circular",
      "totalLiquidVolume": 2000,
      "x": 117.66,
      "y": 56.15,
      "z": 42
    },
    "A6": {
      "depth": 42,
      "diameter": 8.5,
      "shape": "circular",
      "totalLiquidVolume": 2000,
      "x": 117.66,
      "y": 75.43,
      "z": 42
    }
  },
  "brand": {
    "brand": "Opentrons",
    "brandId": [],
    "links": [
      "https://shop.opentrons.com/collections/opentrons-tips/products/tube-rack-set-1"
    ]
  },
  "groups": [
    {
      "wells": [
        "A1",
        "B1",
        "C1",
        "D1",
        "A2",
        "B2",
        "C2",
        "D2",
        "A3",
        "B3",
        "C3",
        "D3",
        "A4",
        "B4",
        "C4",
        "D4",
        "A5",
        "B5",
        "C5",
        "D5",
        "A6",
        "B6",
        "C6",
        "D6"
      ],
      "metadata": {
        "displayName": "Generic 2 mL Screwcap",
        "displayCategory": "tubeRack",
        "wellBottomShape": "v"
      },
      "brand": {
        "brand": "generic",
        "brandId": [],
        "links": []
      }
    }
  ],
  "cornerOffsetFromSlot": {
    "x": 0,
    "y": 0,
    "z": 0
  }
}
