{
  "ordering": [["A1"]],
  "brand": {
    "brand": "NEST",
    "brandId": ["360206", "360266"],
    "links": ["https://www.nest-biotech.com/reagent-reserviors"]
  },
  "metadata": {
    "displayName": "NEST 1 Well Reservoir 290 mL",
    "displayCategory": "reservoir",
    "displayVolumeUnits": "mL",
    "tags": []
  },
  "dimensions": {
    "xDimension": 127.76,
    "yDimension": 85.47,
    "zDimension": 44.4
  },
  "wells": {
    "A1": {
      "depth": 39.55,
      "shape": "rectangular",
      "xDimension": 106.8,
      "yDimension": 71.2,
      "totalLiquidVolume": 290000,
      "x": 63.88,
      "y": 42.74,
      "z": 4.85
    }
  },
  "groups": [
    {
      "metadata": {
        "wellBottomShape": "v"
      },
      "wells": ["A1"]
    }
  ],
  "parameters": {
    "format": "trough",
    "isTiprack": false,
    "isMagneticModuleCompatible": false,
    "quirks": ["centerMultichannelOnWells", "touchTipDisabled"],
    "loadName": "nest_1_reservoir_290ml"
  },
  "namespace": "opentrons",
  "version": 1,
  "schemaVersion": 2,
  "cornerOffsetFromSlot": {
    "x": 0,
    "y": 0,
    "z": 0
  }
}
