{
  "ordering": [["A1"]],
  "metadata": {
    "displayCategory": "trash",
    "displayVolumeUnits": "mL",
    "displayName": "Opentrons Fixed Trash",
    "tags": []
  },
  "schemaVersion": 2,
  "version": 1,
  "namespace": "opentrons",
  "dimensions": {
    "xDimension": 172.86,
    "yDimension": 165.86,
    "zDimension": 82
  },
  "parameters": {
    "format": "trash",
    "isTiprack": false,
    "loadName": "opentrons_1_trash_1100ml_fixed",
    "isMagneticModuleCompatible": false,
    "quirks": ["fixedTrash", "centerMultichannelOnWells", "touchTipDisabled"]
  },
  "wells": {
    "A1": {
      "shape": "rectangular",
      "yDimension": 165.67,
      "xDimension": 107.11,
      "totalLiquidVolume": 1100000,
      "depth": 0,
      "x": 82.84,
      "y": 80,
      "z": 82
    }
  },
  "brand": {
    "brand": "Opentrons"
  },
  "groups": [
    {
      "wells": ["A1"],
      "metadata": {}
    }
  ],
  "cornerOffsetFromSlot": {
    "x": 0,
    "y": 0,
    "z": 0
  }
}
