{
  "ordering": [
    ["A1", "B1", "C1", "D1"],
    ["A2", "B2", "C2", "D2"],
    ["A3", "B3", "C3", "D3"],
    ["A4", "B4", "C4", "D4"],
    ["A5", "B5", "C5", "D5"],
    ["A6", "B6", "C6", "D6"]
  ],
  "brand": {
    "brand": "Opentrons",
    "brandId": [],
    "links": []
  },
  "metadata": {
    "displayName": "Opentrons 24 Tube Rack (Acrylic) with Generic 0.75 mL Snapcap",
    "displayCategory": "tubeRack",
    "displayVolumeUnits": "mL",
    "tags": []
  },
  "dimensions": {
    "xDimension": 127.76,
    "yDimension": 85.48,
    "zDimension": 55
  },
  "wells": {
    "D1": {
      "depth": 20,
      "shape": "circular",
      "diameter": 6,
      "totalLiquidVolume": 750,
      "x": 16.76,
      "y": 11.94,
      "z": 35
    },
    "C1": {
      "depth": 20,
      "shape": "circular",
      "diameter": 6,
      "totalLiquidVolume": 750,
      "x": 16.76,
      "y": 31.5,
      "z": 35
    },
    "B1": {
      "depth": 20,
      "shape": "circular",
      "diameter": 6,
      "totalLiquidVolume": 750,
      "x": 16.76,
      "y": 51.06,
      "z": 35
    },
    "A1": {
      "depth": 20,
      "shape": "circular",
      "diameter": 6,
      "totalLiquidVolume": 750,
      "x": 16.76,
      "y": 70.62,
      "z": 35
    },
    "D2": {
      "depth": 20,
      "shape": "circular",
      "diameter": 6,
      "totalLiquidVolume": 750,
      "x": 36.32,
      "y": 11.94,
      "z": 35
    },
    "C2": {
      "depth": 20,
      "shape": "circular",
      "diameter": 6,
      "totalLiquidVolume": 750,
      "x": 36.32,
      "y": 31.5,
      "z": 35
    },
    "B2": {
      "depth": 20,
      "shape": "circular",
      "diameter": 6,
      "totalLiquidVolume": 750,
      "x": 36.32,
      "y": 51.06,
      "z": 35
    },
    "A2": {
      "depth": 20,
      "shape": "circular",
      "diameter": 6,
      "totalLiquidVolume": 750,
      "x": 36.32,
      "y": 70.62,
      "z": 35
    },
    "D3": {
      "depth": 20,
      "shape": "circular",
      "diameter": 6,
      "totalLiquidVolume": 750,
      "x": 55.88,
      "y": 11.94,
      "z": 35
    },
    "C3": {
      "depth": 20,
      "shape": "circular",
      "diameter": 6,
      "totalLiquidVolume": 750,
      "x": 55.88,
      "y": 31.5,
      "z": 35
    },
    "B3": {
      "depth": 20,
      "shape": "circular",
      "diameter": 6,
      "totalLiquidVolume": 750,
      "x": 55.88,
      "y": 51.06,
      "z": 35
    },
    "A3": {
      "depth": 20,
      "shape": "circular",
      "diameter": 6,
      "totalLiquidVolume": 750,
      "x": 55.88,
      "y": 70.62,
      "z": 35
    },
    "D4": {
      "depth": 20,
      "shape": "circular",
      "diameter": 6,
      "totalLiquidVolume": 750,
      "x": 75.44,
      "y": 11.94,
      "z": 35
    },
    "C4": {
      "depth": 20,
      "shape": "circular",
      "diameter": 6,
      "totalLiquidVolume": 750,
      "x": 75.44,
      "y": 31.5,
      "z": 35
    },
    "B4": {
      "depth": 20,
      "shape": "circular",
      "diameter": 6,
      "totalLiquidVolume": 750,
      "x": 75.44,
      "y": 51.06,
      "z": 35
    },
    "A4": {
      "depth": 20,
      "shape": "circular",
      "diameter": 6,
      "totalLiquidVolume": 750,
      "x": 75.44,
      "y": 70.62,
      "z": 35
    },
    "D5": {
      "depth": 20,
      "shape": "circular",
      "diameter": 6,
      "totalLiquidVolume": 750,
      "x": 95,
      "y": 11.94,
      "z": 35
    },
    "C5": {
      "depth": 20,
      "shape": "circular",
      "diameter": 6,
      "totalLiquidVolume": 750,
      "x": 95,
      "y": 31.5,
      "z": 35
    },
    "B5": {
      "depth": 20,
      "shape": "circular",
      "diameter": 6,
      "totalLiquidVolume": 750,
      "x": 95,
      "y": 51.06,
      "z": 35
    },
    "A5": {
      "depth": 20,
      "shape": "circular",
      "diameter": 6,
      "totalLiquidVolume": 750,
      "x": 95,
      "y": 70.62,
      "z": 35
    },
    "D6": {
      "depth": 20,
      "shape": "circular",
      "diameter": 6,
      "totalLiquidVolume": 750,
      "x": 114.56,
      "y": 11.94,
      "z": 35
    },
    "C6": {
      "depth": 20,
      "shape": "circular",
      "diameter": 6,
      "totalLiquidVolume": 750,
      "x": 114.56,
      "y": 31.5,
      "z": 35
    },
    "B6": {
      "depth": 20,
      "shape": "circular",
      "diameter": 6,
      "totalLiquidVolume": 750,
      "x": 114.56,
      "y": 51.06,
      "z": 35
    },
    "A6": {
      "depth": 20,
      "shape": "circular",
      "diameter": 6,
      "totalLiquidVolume": 750,
      "x": 114.56,
      "y": 70.62,
      "z": 35
    }
  },
  "parameters": {
    "format": "irregular",
    "isTiprack": false,
    "isMagneticModuleCompatible": false,
    "loadName": "opentrons_24_tuberack_generic_0.75ml_snapcap_acrylic"
  },
  "groups": [
    {
      "wells": [
        "A1",
        "B1",
        "C1",
        "D1",
        "A2",
        "B2",
        "C2",
        "D2",
        "A3",
        "B3",
        "C3",
        "D3",
        "A4",
        "B4",
        "C4",
        "D4",
        "A5",
        "B5",
        "C5",
        "D5",
        "A6",
        "B6",
        "C6",
        "D6"
      ],
      "metadata": {
        "displayName": "Generic 0.75 mL Snapcap",
        "displayCategory": "tubeRack",
        "wellBottomShape": "v"
      },
      "brand": {
        "brand": "generic",
        "brandId": [],
        "links": []
      }
    }
  ],
  "namespace": "opentrons",
  "version": 1,
  "schemaVersion": 2,
  "cornerOffsetFromSlot": {
    "x": 0,
    "y": 0,
    "z": 0
  }
}
