{
  "ordering": [["A1", "B1"]],
  "brand": {
    "brand": "Opentrons",
    "brandId": []
  },
  "metadata": {
    "displayName": "Opentrons Calibration Adapter - Thermocycler Module",
    "displayCategory": "other",
    "displayVolumeUnits": "mL",
    "tags": []
  },
  "dimensions": {
    "xDimension": 116.25,
    "yDimension": 80.5,
    "zDimension": 27.5
  },
  "wells": {
    "A1": {
      "depth": 4.75,
      "totalLiquidVolume": 0,
      "shape": "rectangular",
      "xDimension": 20,
      "yDimension": 20,
      "x": 92.88,
      "y": 40.25,
      "z": 22.75
    },
    "B1": {
      "depth": 0,
      "totalLiquidVolume": 0,
      "shape": "circular",
      "diameter": 1,
      "x": 105.88,
      "y": 53.25,
      "z": 27.5
    }
  },
  "groups": [
    {
      "metadata": {
        "wellBottomShape": "flat"
      },
      "wells": ["A1", "B1"]
    }
  ],
  "parameters": {
    "format": "irregular",
    "quirks": [],
    "isTiprack": false,
    "isMagneticModuleCompatible": false,
    "loadName": "opentrons_calibration_adapter_thermocycler_module"
  },
  "namespace": "opentrons",
  "version": 1,
  "schemaVersion": 2,
  "cornerOffsetFromSlot": {
    "x": 5.875,
    "y": 2.75,
    "z": 0
  }
}
